{
  "version": "1.0.0",
  "business_type": "beach_bar",
  "country": "es",
  "currency": "EUR",
  "categories": [
    {
      "code": "cafes",
      "name": "Cafes",
      "icon": "cafe-outline",
      "tax_class_hint": "reduced",
      "order": 1
    },
    {
      "code": "refrescos",
      "name": "Refrescos",
      "icon": "water-outline",
      "tax_class_hint": "reduced",
      "order": 2
    },
    {
      "code": "aguas",
      "name": "Aguas",
      "icon": "water-outline",
      "tax_class_hint": "reduced",
      "order": 3
    },
    {
      "code": "zumos",
      "name": "Zumos",
      "icon": "nutrition-outline",
      "tax_class_hint": "reduced",
      "order": 4
    },
    {
      "code": "infusiones",
      "name": "Infusiones y Te",
      "icon": "leaf-outline",
      "tax_class_hint": "reduced",
      "order": 5
    },
    {
      "code": "cervezas",
      "name": "Cervezas",
      "icon": "beer-outline",
      "tax_class_hint": "standard",
      "order": 10
    },
    {
      "code": "vinos",
      "name": "Vinos",
      "icon": "wine-outline",
      "tax_class_hint": "standard",
      "order": 11
    },
    {
      "code": "licores",
      "name": "Licores y Destilados",
      "icon": "wine-outline",
      "tax_class_hint": "standard",
      "order": 12
    },
    {
      "code": "cocktails",
      "name": "Cocteles",
      "icon": "wine-outline",
      "tax_class_hint": "standard",
      "order": 13
    },
    {
      "code": "pescados",
      "name": "Pescados y Mariscos",
      "icon": "fish-outline",
      "tax_class_hint": "reduced",
      "order": 1
    },
    {
      "code": "arroces",
      "name": "Arroces",
      "icon": "restaurant-outline",
      "tax_class_hint": "reduced",
      "order": 2
    },
    {
      "code": "entrantes",
      "name": "Entrantes",
      "icon": "leaf-outline",
      "tax_class_hint": "reduced",
      "order": 3
    },
    {
      "code": "ensaladas",
      "name": "Ensaladas",
      "icon": "nutrition-outline",
      "tax_class_hint": "reduced",
      "order": 4
    },
    {
      "code": "postres",
      "name": "Postres",
      "icon": "ice-cream-outline",
      "tax_class_hint": "reduced",
      "order": 5
    }
  ],
  "products": [
    {
      "code": "cafe_solo",
      "name": "Cafe solo",
      "category": "cafes",
      "tax_class_hint": "reduced",
      "price": 1.3
    },
    {
      "code": "cafe_cortado",
      "name": "Cafe cortado",
      "category": "cafes",
      "tax_class_hint": "reduced",
      "price": 1.4
    },
    {
      "code": "cafe_con_leche",
      "name": "Cafe con leche",
      "category": "cafes",
      "tax_class_hint": "reduced",
      "price": 1.6
    },
    {
      "code": "capuchino",
      "name": "Capuchino",
      "category": "cafes",
      "tax_class_hint": "reduced",
      "price": 2.0
    },
    {
      "code": "descafeinado",
      "name": "Descafeinado",
      "category": "cafes",
      "tax_class_hint": "reduced",
      "price": 1.4
    },
    {
      "code": "carajillo",
      "name": "Carajillo",
      "category": "cafes",
      "tax_class_hint": "reduced",
      "price": 2.5
    },
    {
      "code": "coca_cola",
      "name": "Coca-Cola",
      "category": "refrescos",
      "tax_class_hint": "reduced",
      "price": 2.5
    },
    {
      "code": "coca_cola_zero",
      "name": "Coca-Cola Zero",
      "category": "refrescos",
      "tax_class_hint": "reduced",
      "price": 2.5
    },
    {
      "code": "fanta_naranja",
      "name": "Fanta naranja",
      "category": "refrescos",
      "tax_class_hint": "reduced",
      "price": 2.5
    },
    {
      "code": "fanta_limon",
      "name": "Fanta limon",
      "category": "refrescos",
      "tax_class_hint": "reduced",
      "price": 2.5
    },
    {
      "code": "sprite",
      "name": "Sprite",
      "category": "refrescos",
      "tax_class_hint": "reduced",
      "price": 2.5
    },
    {
      "code": "aquarius",
      "name": "Aquarius",
      "category": "refrescos",
      "tax_class_hint": "reduced",
      "price": 2.5
    },
    {
      "code": "tonica",
      "name": "Tonica",
      "category": "refrescos",
      "tax_class_hint": "reduced",
      "price": 2.5
    },
    {
      "code": "agua_mineral",
      "name": "Agua mineral",
      "category": "aguas",
      "tax_class_hint": "reduced",
      "price": 1.8
    },
    {
      "code": "agua_con_gas",
      "name": "Agua con gas",
      "category": "aguas",
      "tax_class_hint": "reduced",
      "price": 2.0
    },
    {
      "code": "zumo_naranja",
      "name": "Zumo de naranja",
      "category": "zumos",
      "tax_class_hint": "reduced",
      "price": 3.0
    },
    {
      "code": "zumo_tomate",
      "name": "Zumo de tomate",
      "category": "zumos",
      "tax_class_hint": "reduced",
      "price": 2.8
    },
    {
      "code": "zumo_pina",
      "name": "Zumo de pina",
      "category": "zumos",
      "tax_class_hint": "reduced",
      "price": 2.8
    },
    {
      "code": "te_negro",
      "name": "Te negro",
      "category": "infusiones",
      "tax_class_hint": "reduced",
      "price": 1.8
    },
    {
      "code": "te_verde",
      "name": "Te verde",
      "category": "infusiones",
      "tax_class_hint": "reduced",
      "price": 1.8
    },
    {
      "code": "manzanilla",
      "name": "Manzanilla",
      "category": "infusiones",
      "tax_class_hint": "reduced",
      "price": 1.8
    },
    {
      "code": "poleo_menta",
      "name": "Poleo menta",
      "category": "infusiones",
      "tax_class_hint": "reduced",
      "price": 1.8
    },
    {
      "code": "cerveza_cana",
      "name": "Cana",
      "category": "cervezas",
      "tax_class_hint": "standard",
      "price": 1.8
    },
    {
      "code": "cerveza_jarra",
      "name": "Jarra de cerveza",
      "category": "cervezas",
      "tax_class_hint": "standard",
      "price": 3.5
    },
    {
      "code": "cerveza_botella",
      "name": "Cerveza botella",
      "category": "cervezas",
      "tax_class_hint": "standard",
      "price": 2.5
    },
    {
      "code": "cerveza_sin",
      "name": "Cerveza sin alcohol",
      "category": "cervezas",
      "tax_class_hint": "reduced",
      "price": 2.2
    },
    {
      "code": "clara",
      "name": "Clara",
      "category": "cervezas",
      "tax_class_hint": "standard",
      "price": 2.0
    },
    {
      "code": "vino_tinto_copa",
      "name": "Vino tinto (copa)",
      "category": "vinos",
      "tax_class_hint": "standard",
      "price": 3.0
    },
    {
      "code": "vino_blanco_copa",
      "name": "Vino blanco (copa)",
      "category": "vinos",
      "tax_class_hint": "standard",
      "price": 3.0
    },
    {
      "code": "vino_rosado_copa",
      "name": "Vino rosado (copa)",
      "category": "vinos",
      "tax_class_hint": "standard",
      "price": 3.0
    },
    {
      "code": "sangria_jarra",
      "name": "Sangria (jarra)",
      "category": "vinos",
      "tax_class_hint": "standard",
      "price": 12.0
    },
    {
      "code": "tinto_verano",
      "name": "Tinto de verano",
      "category": "vinos",
      "tax_class_hint": "standard",
      "price": 2.5
    },
    {
      "code": "vermut",
      "name": "Vermut",
      "category": "licores",
      "tax_class_hint": "standard",
      "price": 3.0
    },
    {
      "code": "gin_tonic",
      "name": "Gin tonic",
      "category": "cocktails",
      "tax_class_hint": "standard",
      "price": 8.0
    },
    {
      "code": "ron_cola",
      "name": "Cubata de ron",
      "category": "cocktails",
      "tax_class_hint": "standard",
      "price": 7.0
    },
    {
      "code": "whisky_cola",
      "name": "Cubata de whisky",
      "category": "cocktails",
      "tax_class_hint": "standard",
      "price": 7.0
    },
    {
      "code": "mojito",
      "name": "Mojito",
      "category": "cocktails",
      "tax_class_hint": "standard",
      "price": 8.5
    },
    {
      "code": "espeto_sardinas",
      "name": "Espeto de sardinas",
      "category": "pescados",
      "tax_class_hint": "reduced",
      "price": 8.0
    },
    {
      "code": "gambas_plancha",
      "name": "Gambas a la plancha",
      "category": "pescados",
      "tax_class_hint": "reduced",
      "price": 14.0
    },
    {
      "code": "pescaito_frito",
      "name": "Pescaito frito",
      "category": "pescados",
      "tax_class_hint": "reduced",
      "price": 12.0
    },
    {
      "code": "calamares_romana",
      "name": "Calamares a la romana",
      "category": "pescados",
      "tax_class_hint": "reduced",
      "price": 10.0
    },
    {
      "code": "pulpo_gallega",
      "name": "Pulpo a la gallega",
      "category": "pescados",
      "tax_class_hint": "reduced",
      "price": 16.0
    },
    {
      "code": "paella_marisco",
      "name": "Paella de marisco",
      "category": "arroces",
      "tax_class_hint": "reduced",
      "price": 15.0
    },
    {
      "code": "arroz_banda",
      "name": "Arroz a banda",
      "category": "arroces",
      "tax_class_hint": "reduced",
      "price": 13.0
    },
    {
      "code": "gazpacho",
      "name": "Gazpacho",
      "category": "entrantes",
      "tax_class_hint": "reduced",
      "price": 5.5
    },
    {
      "code": "patatas_bravas",
      "name": "Patatas bravas",
      "category": "entrantes",
      "tax_class_hint": "reduced",
      "price": 6.0
    },
    {
      "code": "ensalada_mixta",
      "name": "Ensalada mixta",
      "category": "ensaladas",
      "tax_class_hint": "reduced",
      "price": 7.0
    },
    {
      "code": "helado_bola",
      "name": "Helado (bola)",
      "category": "postres",
      "tax_class_hint": "reduced",
      "price": 2.5
    },
    {
      "code": "flan_casero",
      "name": "Flan casero",
      "category": "postres",
      "tax_class_hint": "reduced",
      "price": 5.0
    }
  ]
}