{
  "version": "1.0.0",
  "business_type": "electronics",
  "country": "es",
  "currency": "EUR",
  "categories": [
    {
      "code": "smartphones",
      "name": "Smartphones",
      "icon": "phone-portrait-outline",
      "tax_class_hint": "standard",
      "order": 1
    },
    {
      "code": "portatiles",
      "name": "Portatiles",
      "icon": "laptop-outline",
      "tax_class_hint": "standard",
      "order": 2
    },
    {
      "code": "accesorios",
      "name": "Accesorios",
      "icon": "headset-outline",
      "tax_class_hint": "standard",
      "order": 3
    },
    {
      "code": "televisores",
      "name": "Televisores",
      "icon": "tv-outline",
      "tax_class_hint": "standard",
      "order": 4
    },
    {
      "code": "gaming",
      "name": "Gaming",
      "icon": "game-controller-outline",
      "tax_class_hint": "standard",
      "order": 5
    }
  ],
  "products": [
    {
      "code": "smartphone_gama_media",
      "name": "Smartphone gama media",
      "category": "smartphones",
      "tax_class_hint": "standard",
      "price": 299.0,
      "image": "retail/smartphone_gama_media.jpg"
    },
    {
      "code": "smartphone_gama_alta",
      "name": "Smartphone gama alta",
      "category": "smartphones",
      "tax_class_hint": "standard",
      "price": 699.0,
      "image": "retail/smartphone_gama_alta.jpg"
    },
    {
      "code": "smartphone_basico",
      "name": "Smartphone basico",
      "category": "smartphones",
      "tax_class_hint": "standard",
      "price": 149.0,
      "image": "retail/smartphone_basico.jpg"
    },
    {
      "code": "portatil_basico",
      "name": "Portatil basico",
      "category": "portatiles",
      "tax_class_hint": "standard",
      "price": 449.0,
      "image": "retail/portatil_basico.jpg"
    },
    {
      "code": "portatil_gaming",
      "name": "Portatil gaming",
      "category": "portatiles",
      "tax_class_hint": "standard",
      "price": 999.0,
      "image": "retail/portatil_gaming.jpg"
    },
    {
      "code": "portatil_ultrabook",
      "name": "Ultrabook",
      "category": "portatiles",
      "tax_class_hint": "standard",
      "price": 799.0,
      "image": "retail/portatil_ultrabook.jpg"
    },
    {
      "code": "tablet",
      "name": "Tablet",
      "category": "portatiles",
      "tax_class_hint": "standard",
      "price": 349.0,
      "image": "retail/tablet.jpg"
    },
    {
      "code": "auriculares_bluetooth",
      "name": "Auriculares Bluetooth",
      "category": "accesorios",
      "tax_class_hint": "standard",
      "price": 49.99,
      "image": "retail/auriculares_bluetooth.jpg"
    },
    {
      "code": "cargador_rapido",
      "name": "Cargador rapido",
      "category": "accesorios",
      "tax_class_hint": "standard",
      "price": 24.99,
      "image": "retail/cargador_rapido.jpg"
    },
    {
      "code": "funda_movil",
      "name": "Funda de movil",
      "category": "accesorios",
      "tax_class_hint": "standard",
      "price": 14.99,
      "image": "retail/funda_movil.jpg"
    },
    {
      "code": "cable_usb",
      "name": "Cable USB-C",
      "category": "accesorios",
      "tax_class_hint": "standard",
      "price": 9.99,
      "image": "retail/cable_usb.jpg"
    },
    {
      "code": "powerbank",
      "name": "Powerbank 10000mAh",
      "category": "accesorios",
      "tax_class_hint": "standard",
      "price": 19.99,
      "image": "retail/powerbank.jpg"
    },
    {
      "code": "smartwatch",
      "name": "Smartwatch",
      "category": "accesorios",
      "tax_class_hint": "standard",
      "price": 129.0,
      "image": "retail/smartwatch.jpg"
    },
    {
      "code": "tv_43",
      "name": "TV 43 pulgadas",
      "category": "televisores",
      "tax_class_hint": "standard",
      "price": 349.0,
      "image": "retail/tv_43.jpg"
    },
    {
      "code": "tv_55",
      "name": "TV 55 pulgadas",
      "category": "televisores",
      "tax_class_hint": "standard",
      "price": 499.0,
      "image": "retail/tv_55.jpg"
    },
    {
      "code": "barra_sonido",
      "name": "Barra de sonido",
      "category": "televisores",
      "tax_class_hint": "standard",
      "price": 149.0,
      "image": "retail/barra_sonido.jpg"
    },
    {
      "code": "consola",
      "name": "Consola",
      "category": "gaming",
      "tax_class_hint": "standard",
      "price": 499.0,
      "image": "retail/consola.jpg"
    },
    {
      "code": "mando",
      "name": "Mando extra",
      "category": "gaming",
      "tax_class_hint": "standard",
      "price": 59.99,
      "image": "retail/mando.jpg"
    },
    {
      "code": "videojuego",
      "name": "Videojuego",
      "category": "gaming",
      "tax_class_hint": "standard",
      "price": 69.99,
      "image": "retail/videojuego.jpg"
    }
  ]
}
