{
  "version": "1.0.0",
  "business_type": "bakery",
  "country": "es",
  "currency": "EUR",
  "categories": [
    {
      "code": "cafes",
      "name": "Cafes",
      "icon": "cafe-outline",
      "tax_class_hint": "reduced",
      "order": 1
    },
    {
      "code": "refrescos",
      "name": "Refrescos",
      "icon": "water-outline",
      "tax_class_hint": "reduced",
      "order": 2
    },
    {
      "code": "aguas",
      "name": "Aguas",
      "icon": "water-outline",
      "tax_class_hint": "reduced",
      "order": 3
    },
    {
      "code": "zumos",
      "name": "Zumos",
      "icon": "nutrition-outline",
      "tax_class_hint": "reduced",
      "order": 4
    },
    {
      "code": "infusiones",
      "name": "Infusiones y Te",
      "icon": "leaf-outline",
      "tax_class_hint": "reduced",
      "order": 5
    },
    {
      "code": "panes",
      "name": "Panes",
      "icon": "restaurant-outline",
      "tax_class_hint": "super_reduced",
      "order": 1
    },
    {
      "code": "bolleria",
      "name": "Bolleria",
      "icon": "cafe-outline",
      "tax_class_hint": "reduced",
      "order": 2
    },
    {
      "code": "tartas",
      "name": "Tartas y Pasteles",
      "icon": "ice-cream-outline",
      "tax_class_hint": "reduced",
      "order": 3
    },
    {
      "code": "bocadillos",
      "name": "Bocadillos",
      "icon": "fast-food-outline",
      "tax_class_hint": "reduced",
      "order": 4
    },
    {
      "code": "galletas",
      "name": "Galletas",
      "icon": "restaurant-outline",
      "tax_class_hint": "reduced",
      "order": 5
    }
  ],
  "products": [
    {
      "code": "cafe_solo",
      "name": "Cafe solo",
      "category": "cafes",
      "tax_class_hint": "reduced",
      "price": 1.3,
      "image": "hospitality/cafe_solo.webp"
    },
    {
      "code": "cafe_cortado",
      "name": "Cafe cortado",
      "category": "cafes",
      "tax_class_hint": "reduced",
      "price": 1.4,
      "image": "hospitality/cafe_cortado.webp"
    },
    {
      "code": "cafe_con_leche",
      "name": "Cafe con leche",
      "category": "cafes",
      "tax_class_hint": "reduced",
      "price": 1.6,
      "image": "hospitality/cafe_con_leche.webp"
    },
    {
      "code": "capuchino",
      "name": "Capuchino",
      "category": "cafes",
      "tax_class_hint": "reduced",
      "price": 2.0,
      "image": "hospitality/capuchino.webp"
    },
    {
      "code": "descafeinado",
      "name": "Descafeinado",
      "category": "cafes",
      "tax_class_hint": "reduced",
      "price": 1.4,
      "image": "hospitality/descafeinado.webp"
    },
    {
      "code": "carajillo",
      "name": "Carajillo",
      "category": "cafes",
      "tax_class_hint": "reduced",
      "price": 2.5,
      "image": "hospitality/carajillo.webp"
    },
    {
      "code": "coca_cola",
      "name": "Coca-Cola",
      "category": "refrescos",
      "tax_class_hint": "reduced",
      "price": 2.5,
      "image": "hospitality/coca_cola.webp"
    },
    {
      "code": "coca_cola_zero",
      "name": "Coca-Cola Zero",
      "category": "refrescos",
      "tax_class_hint": "reduced",
      "price": 2.5,
      "image": "hospitality/coca_cola_zero.webp"
    },
    {
      "code": "fanta_naranja",
      "name": "Fanta naranja",
      "category": "refrescos",
      "tax_class_hint": "reduced",
      "price": 2.5,
      "image": "hospitality/fanta_naranja.webp"
    },
    {
      "code": "fanta_limon",
      "name": "Fanta limon",
      "category": "refrescos",
      "tax_class_hint": "reduced",
      "price": 2.5,
      "image": "hospitality/fanta_limon.webp"
    },
    {
      "code": "sprite",
      "name": "Sprite",
      "category": "refrescos",
      "tax_class_hint": "reduced",
      "price": 2.5,
      "image": "hospitality/sprite.jpg"
    },
    {
      "code": "aquarius",
      "name": "Aquarius",
      "category": "refrescos",
      "tax_class_hint": "reduced",
      "price": 2.5,
      "image": "hospitality/aquarius.webp"
    },
    {
      "code": "tonica",
      "name": "Tonica",
      "category": "refrescos",
      "tax_class_hint": "reduced",
      "price": 2.5,
      "image": "hospitality/tonica.jpg"
    },
    {
      "code": "agua_mineral",
      "name": "Agua mineral",
      "category": "aguas",
      "tax_class_hint": "reduced",
      "price": 1.8,
      "image": "hospitality/agua_mineral.webp"
    },
    {
      "code": "agua_con_gas",
      "name": "Agua con gas",
      "category": "aguas",
      "tax_class_hint": "reduced",
      "price": 2.0,
      "image": "hospitality/agua_con_gas.webp"
    },
    {
      "code": "zumo_naranja",
      "name": "Zumo de naranja",
      "category": "zumos",
      "tax_class_hint": "reduced",
      "price": 3.0,
      "image": "hospitality/zumo_naranja.jpg"
    },
    {
      "code": "zumo_tomate",
      "name": "Zumo de tomate",
      "category": "zumos",
      "tax_class_hint": "reduced",
      "price": 2.8,
      "image": "hospitality/zumo_tomate.jpg"
    },
    {
      "code": "zumo_pina",
      "name": "Zumo de pina",
      "category": "zumos",
      "tax_class_hint": "reduced",
      "price": 2.8,
      "image": "hospitality/zumo_pina.jpg"
    },
    {
      "code": "te_negro",
      "name": "Te negro",
      "category": "infusiones",
      "tax_class_hint": "reduced",
      "price": 1.8,
      "image": "hospitality/te_negro.jpg"
    },
    {
      "code": "te_verde",
      "name": "Te verde",
      "category": "infusiones",
      "tax_class_hint": "reduced",
      "price": 1.8,
      "image": "hospitality/te_verde.jpg"
    },
    {
      "code": "manzanilla",
      "name": "Manzanilla",
      "category": "infusiones",
      "tax_class_hint": "reduced",
      "price": 1.8,
      "image": "hospitality/manzanilla.jpg"
    },
    {
      "code": "poleo_menta",
      "name": "Poleo menta",
      "category": "infusiones",
      "tax_class_hint": "reduced",
      "price": 1.8,
      "image": "hospitality/poleo_menta.webp"
    },
    {
      "code": "barra_pan",
      "name": "Barra de pan",
      "category": "panes",
      "tax_class_hint": "super_reduced",
      "price": 1.0,
      "image": "hospitality/barra_pan.webp"
    },
    {
      "code": "hogaza",
      "name": "Hogaza",
      "category": "panes",
      "tax_class_hint": "super_reduced",
      "price": 2.5,
      "image": "hospitality/hogaza.jpg"
    },
    {
      "code": "chapata",
      "name": "Chapata",
      "category": "panes",
      "tax_class_hint": "super_reduced",
      "price": 1.8,
      "image": "hospitality/chapata.webp"
    },
    {
      "code": "pan_integral",
      "name": "Pan integral",
      "category": "panes",
      "tax_class_hint": "super_reduced",
      "price": 2.2,
      "image": "hospitality/pan_integral.jpg"
    },
    {
      "code": "pan_centeno",
      "name": "Pan de centeno",
      "category": "panes",
      "tax_class_hint": "super_reduced",
      "price": 2.8,
      "image": "hospitality/pan_centeno.jpg"
    },
    {
      "code": "pan_semillas",
      "name": "Pan de semillas",
      "category": "panes",
      "tax_class_hint": "super_reduced",
      "price": 3.0,
      "image": "hospitality/pan_semillas.jpg"
    },
    {
      "code": "croissant",
      "name": "Croissant",
      "category": "bolleria",
      "tax_class_hint": "reduced",
      "price": 1.5,
      "image": "hospitality/croissant.webp"
    },
    {
      "code": "napolitana_chocolate",
      "name": "Napolitana de chocolate",
      "category": "bolleria",
      "tax_class_hint": "reduced",
      "price": 1.8,
      "image": "hospitality/napolitana_chocolate.jpg"
    },
    {
      "code": "ensaimada",
      "name": "Ensaimada",
      "category": "bolleria",
      "tax_class_hint": "reduced",
      "price": 2.0,
      "image": "hospitality/ensaimada.webp"
    },
    {
      "code": "palmera_chocolate",
      "name": "Palmera de chocolate",
      "category": "bolleria",
      "tax_class_hint": "reduced",
      "price": 2.5,
      "image": "hospitality/palmera_chocolate.jpg"
    },
    {
      "code": "magdalena",
      "name": "Magdalena",
      "category": "bolleria",
      "tax_class_hint": "reduced",
      "price": 1.2,
      "image": "hospitality/magdalena.jpg"
    },
    {
      "code": "tarta_manzana",
      "name": "Tarta de manzana",
      "category": "tartas",
      "tax_class_hint": "reduced",
      "price": 3.5,
      "image": "hospitality/tarta_manzana.jpg"
    },
    {
      "code": "tarta_queso",
      "name": "Tarta de queso",
      "category": "tartas",
      "tax_class_hint": "reduced",
      "price": 3.8,
      "image": "hospitality/tarta_queso.jpg"
    },
    {
      "code": "tarta_chocolate",
      "name": "Tarta de chocolate",
      "category": "tartas",
      "tax_class_hint": "reduced",
      "price": 3.8,
      "image": "hospitality/tarta_chocolate.jpg"
    },
    {
      "code": "bocadillo_jamon_queso",
      "name": "Bocadillo de jamon y queso",
      "category": "bocadillos",
      "tax_class_hint": "reduced",
      "price": 4.0,
      "image": "hospitality/bocadillo_jamon_queso.webp"
    },
    {
      "code": "bocadillo_vegetal",
      "name": "Bocadillo vegetal",
      "category": "bocadillos",
      "tax_class_hint": "reduced",
      "price": 3.8,
      "image": "hospitality/bocadillo_vegetal.webp"
    },
    {
      "code": "galleta_mantequilla",
      "name": "Galleta de mantequilla",
      "category": "galletas",
      "tax_class_hint": "reduced",
      "price": 1.0,
      "image": "hospitality/galleta_mantequilla.webp"
    },
    {
      "code": "galleta_chocolate",
      "name": "Galleta con pepitas de chocolate",
      "category": "galletas",
      "tax_class_hint": "reduced",
      "price": 1.2,
      "image": "hospitality/galleta_chocolate.webp"
    }
  ]
}
