{
  "version": "1.0.0",
  "business_type": "cleaning_company",
  "country": "es",
  "currency": "EUR",
  "categories": [
    {
      "code": "limpieza_oficinas",
      "name": "Limpieza de oficinas",
      "icon": "business-outline",
      "tax_class_hint": "standard",
      "order": 1
    },
    {
      "code": "limpieza_comunidades",
      "name": "Comunidades de vecinos",
      "icon": "home-outline",
      "tax_class_hint": "standard",
      "order": 2
    },
    {
      "code": "limpieza_particulares",
      "name": "Particulares",
      "icon": "person-outline",
      "tax_class_hint": "standard",
      "order": 3
    },
    {
      "code": "limpieza_especial",
      "name": "Limpiezas especiales",
      "icon": "sparkles-outline",
      "tax_class_hint": "standard",
      "order": 4
    },
    {
      "code": "cristales",
      "name": "Cristales y fachadas",
      "icon": "grid-outline",
      "tax_class_hint": "standard",
      "order": 5
    }
  ],
  "products": [
    {
      "code": "oficina_pequena_mensual",
      "name": "Oficina pequena (hasta 100m2) mensual",
      "category": "limpieza_oficinas",
      "tax_class_hint": "standard",
      "price": 350.00
    },
    {
      "code": "oficina_mediana_mensual",
      "name": "Oficina mediana (100-300m2) mensual",
      "category": "limpieza_oficinas",
      "tax_class_hint": "standard",
      "price": 650.00
    },
    {
      "code": "oficina_grande_mensual",
      "name": "Oficina grande (300-600m2) mensual",
      "category": "limpieza_oficinas",
      "tax_class_hint": "standard",
      "price": 1100.00
    },
    {
      "code": "oficina_hora_extra",
      "name": "Hora extra limpieza oficina",
      "category": "limpieza_oficinas",
      "tax_class_hint": "standard",
      "price": 18.00
    },
    {
      "code": "despacho_profesional",
      "name": "Despacho profesional (hasta 50m2) mensual",
      "category": "limpieza_oficinas",
      "tax_class_hint": "standard",
      "price": 200.00
    },
    {
      "code": "comunidad_pequena_mensual",
      "name": "Comunidad pequena (hasta 10 vecinos) mensual",
      "category": "limpieza_comunidades",
      "tax_class_hint": "standard",
      "price": 250.00
    },
    {
      "code": "comunidad_mediana_mensual",
      "name": "Comunidad mediana (10-30 vecinos) mensual",
      "category": "limpieza_comunidades",
      "tax_class_hint": "standard",
      "price": 400.00
    },
    {
      "code": "comunidad_grande_mensual",
      "name": "Comunidad grande (30+ vecinos) mensual",
      "category": "limpieza_comunidades",
      "tax_class_hint": "standard",
      "price": 650.00
    },
    {
      "code": "garaje_comunitario_mensual",
      "name": "Garaje comunitario mensual",
      "category": "limpieza_comunidades",
      "tax_class_hint": "standard",
      "price": 180.00
    },
    {
      "code": "hogar_semanal",
      "name": "Limpieza hogar semanal (3h)",
      "category": "limpieza_particulares",
      "tax_class_hint": "standard",
      "price": 45.00
    },
    {
      "code": "hogar_quincenal",
      "name": "Limpieza hogar quincenal (4h)",
      "category": "limpieza_particulares",
      "tax_class_hint": "standard",
      "price": 55.00
    },
    {
      "code": "hogar_puntual",
      "name": "Limpieza puntual domicilio (por hora)",
      "category": "limpieza_particulares",
      "tax_class_hint": "standard",
      "price": 16.00
    },
    {
      "code": "plancha_domicilio",
      "name": "Servicio de plancha a domicilio (2h)",
      "category": "limpieza_particulares",
      "tax_class_hint": "standard",
      "price": 30.00
    },
    {
      "code": "limpieza_fin_obra",
      "name": "Limpieza fin de obra",
      "category": "limpieza_especial",
      "tax_class_hint": "standard",
      "price": 15.00
    },
    {
      "code": "limpieza_mudanza",
      "name": "Limpieza por mudanza (entrada/salida)",
      "category": "limpieza_especial",
      "tax_class_hint": "standard",
      "price": 120.00
    },
    {
      "code": "limpieza_profunda",
      "name": "Limpieza profunda integral",
      "category": "limpieza_especial",
      "tax_class_hint": "standard",
      "price": 180.00
    },
    {
      "code": "desinfeccion",
      "name": "Desinfeccion y sanitizacion",
      "category": "limpieza_especial",
      "tax_class_hint": "standard",
      "price": 200.00
    },
    {
      "code": "limpieza_evento",
      "name": "Limpieza post-evento",
      "category": "limpieza_especial",
      "tax_class_hint": "standard",
      "price": 250.00
    },
    {
      "code": "abrillantado_suelos",
      "name": "Abrillantado de suelos (por m2)",
      "category": "limpieza_especial",
      "tax_class_hint": "standard",
      "price": 3.50
    },
    {
      "code": "cristales_interior",
      "name": "Limpieza cristales interior (por unidad)",
      "category": "cristales",
      "tax_class_hint": "standard",
      "price": 5.00
    },
    {
      "code": "cristales_exterior",
      "name": "Limpieza cristales exterior (por unidad)",
      "category": "cristales",
      "tax_class_hint": "standard",
      "price": 8.00
    },
    {
      "code": "escaparate",
      "name": "Limpieza escaparate comercial",
      "category": "cristales",
      "tax_class_hint": "standard",
      "price": 25.00
    }
  ]
}
